<?xml version="1.0" encoding="utf-8"?>
<?xml-stylesheet type="text/xsl" href="zbozi_feed.xsl"?>
<SHOP xmlns:xsi="http://www.w3.org/2001/XMLSchema-instance"
 xsi:noNamespaceSchemaLocation="zbozi_feed.xsd">
<SHOPITEM>
<PRODUCT>BIO káva NicaMex</PRODUCT>
<DESCRIPTION>Tato směs velmi kvalitních odrůd kávy Arabika z Mexika a Nikaragui pochází z ekologické produkce. Směs se vyznačuje nízkou kyselostí a speciální postup pražení kávě poskytuje výrazné aroma.  Balení: 200 g     </DESCRIPTION>
<URL>http://www.fair-bio.cz/index.php?a=detail&amp;d=1</URL>
<AVAILABILITY>0</AVAILABILITY>
<IMGURL>http://www.fair-bio.cz/galerie/nicamex_kopie.jpg</IMGURL>
<PRICE>69.72</PRICE>
<VAT>9</VAT>
 <SERVICE_LIFE>e5</SERVICE_LIFE>
</SHOPITEM>
<SHOPITEM>
<PRODUCT>BIO káva Nicaragua</PRODUCT>
<DESCRIPTION>Druhově čistá káva typu Arabika, která pochází z hornatých oblastí Nikaragui, kde ji pěstují drobní rolníci ze sdružení Cosatin a UCPCO. Káva Nikaragua je vhodná také do překapávačů a presovačů.  Balení: 250 g    </DESCRIPTION>
<URL>http://www.fair-bio.cz/index.php?a=detail&amp;d=2</URL>
<AVAILABILITY>0</AVAILABILITY>
<IMGURL>http://www.fair-bio.cz/galerie/nikaragua_kopie.jpg</IMGURL>
<PRICE>74.31</PRICE>
<VAT>9</VAT>
 <SERVICE_LIFE>5e5</SERVICE_LIFE>
</SHOPITEM>
<SHOPITEM>
<PRODUCT>BIO káva Nuevo Futuro</PRODUCT>
<DESCRIPTION>Jemně mletá kolumbijská káva typu Arabika s plnou chutí a jemným aroma. Nuevo Futuro je vhodná pro přípravu kávy typu "turek", ale lze ji použít i do překapávačů či presovačů. Tuto kávu pro Vás pěstují drobní zemědělci z Kolumbie z družstev Asprovega a Nuevo Futuro.  Balení: 250 g    </DESCRIPTION>
<URL>http://www.fair-bio.cz/index.php?a=detail&amp;d=3</URL>
<AVAILABILITY>0</AVAILABILITY>
<IMGURL>http://www.fair-bio.cz/galerie/nuevo_futuro_kopie.jpg</IMGURL>
<PRICE>74.31</PRICE>
<VAT>9</VAT>
 <SERVICE_LIFE>500e2</SERVICE_LIFE>
</SHOPITEM>
</SHOP>